{
  "$schema":"https://json-schema.org/draft/2020-12/schema","$id":"urn:uu-aap:exploratory-architecture-sufficiency:0.1","type":"object","additionalProperties":false,
  "required":["artifact_type","version","origin_frontier","tracking_issue","audit_scope","allowed_outcomes","source_bindings","entities","overall","non_effects"],
  "properties":{
    "artifact_type":{"const":"ExploratoryArchitectureSufficiencyAudit"},"version":{"const":"0.1"},"origin_frontier":{"const":"25faf51c5b10c06f752fcb8815fd09f8a7a3e611"},"tracking_issue":{"const":885},
    "audit_scope":{"type":"object","additionalProperties":false,"required":["repository","bounded_current_audit","absence_inference_allowed","exact_materialization_statement","implementation_authority_created"],"properties":{"repository":{"const":"Matawaka/uu-aap"},"bounded_current_audit":{"const":true},"absence_inference_allowed":{"const":false},"exact_materialization_statement":{"const":"exact materialization not found in bounded current audit"},"implementation_authority_created":{"const":false}}},
    "allowed_outcomes":{"const":["REUSE_EXISTING","COMPOSE_EXISTING","ADAPTER_ONLY","PROFILE_ONLY","NEW_COMPONENT_CANDIDATE","INSUFFICIENT_EVIDENCE","NO_NEW_COMPONENT_NEEDED"]},
    "source_bindings":{"type":"array","minItems":13,"maxItems":13,"items":{"type":"object","additionalProperties":false,"required":["id","path","blob"],"properties":{"id":{"type":"string"},"path":{"type":"string"},"blob":{"type":"string","pattern":"^[0-9a-f]{40}$"}}}},
    "entities":{"type":"array","minItems":4,"maxItems":4,"items":{"oneOf":[
      {"type":"object","additionalProperties":false,"required":["id","name","backlog_classification","target_question","evidence_refs","observed_coverage","observed_gap","outcome","architecture_interpretation","new_component_currently_justified","implementation_authorized","adapter_implementation_required","new_core_possibility_primitive_required","physical_world_model_present","current_counterfactual_is_physical_world_model"],"properties":{"id":{"const":"scaf"},"name":{"type":"string","minLength":1},"backlog_classification":{"const":"EXPLORATORY"},"target_question":{"type":"string","minLength":1},"evidence_refs":{"const":["backlog_registry","core","capability_selection","capability_availability","counterfactual_intervention","interface_registry_v0_1"]},"observed_coverage":{"type":"array","minItems":1,"items":{"type":"string","minLength":1}},"observed_gap":{"type":"string","minLength":1},"outcome":{"const":"ADAPTER_ONLY"},"architecture_interpretation":{"type":"string","minLength":1},"new_component_currently_justified":{"const":false},"implementation_authorized":{"const":false},"adapter_implementation_required":{"const":false},"new_core_possibility_primitive_required":{"const":false},"physical_world_model_present":{"const":false},"current_counterfactual_is_physical_world_model":{"const":false}}},
      {"type":"object","additionalProperties":false,"required":["id","name","backlog_classification","target_question","evidence_refs","observed_coverage","observed_gap","outcome","architecture_interpretation","new_component_currently_justified","implementation_authorized","predecessor_rewrite_authorized","historical_assurance_retroactive_upgrade_authorized","profile_implementation_required"],"properties":{"id":{"const":"cpot"},"name":{"type":"string","minLength":1},"backlog_classification":{"const":"EXPLORATORY"},"target_question":{"type":"string","minLength":1},"evidence_refs":{"const":["backlog_registry","core","responsibility_event_chain","future_optionality","roadmap"]},"observed_coverage":{"type":"array","minItems":1,"items":{"type":"string","minLength":1}},"observed_gap":{"type":"string","minLength":1},"outcome":{"const":"PROFILE_ONLY"},"architecture_interpretation":{"type":"string","minLength":1},"new_component_currently_justified":{"const":false},"implementation_authorized":{"const":false},"predecessor_rewrite_authorized":{"const":false},"historical_assurance_retroactive_upgrade_authorized":{"const":false},"profile_implementation_required":{"const":false}}},
      {"type":"object","additionalProperties":false,"required":["id","name","backlog_classification","target_question","evidence_refs","observed_coverage","observed_gap","outcome","architecture_interpretation","new_component_currently_justified","implementation_authorized","suspected_stall_is_failure_proof","diagnostic_perturbation_self_authorized","polling_or_loop_required","stale_authority_reuse_allowed","diagnostic_perturbation_is_action_permit","diagnostic_result_is_causal_proof"],"properties":{"id":{"const":"immune-tremor"},"name":{"type":"string","minLength":1},"backlog_classification":{"const":"EXPLORATORY"},"target_question":{"type":"string","minLength":1},"evidence_refs":{"const":["backlog_registry","fcl","event_responsive_dormancy","interface_registry_v0_1","interface_registry_v0_2"]},"observed_coverage":{"type":"array","minItems":1,"items":{"type":"string","minLength":1}},"observed_gap":{"type":"string","minLength":1},"outcome":{"const":"COMPOSE_EXISTING"},"architecture_interpretation":{"type":"string","minLength":1},"new_component_currently_justified":{"const":false},"implementation_authorized":{"const":false},"suspected_stall_is_failure_proof":{"const":false},"diagnostic_perturbation_self_authorized":{"const":false},"polling_or_loop_required":{"const":false},"stale_authority_reuse_allowed":{"const":false},"diagnostic_perturbation_is_action_permit":{"const":false},"diagnostic_result_is_causal_proof":{"const":false}}},
      {"type":"object","additionalProperties":false,"required":["id","name","backlog_classification","target_question","evidence_refs","observed_coverage","observed_gap","outcome","architecture_interpretation","new_component_currently_justified","implementation_authorized","generic_self_generated_reentry_interface_established","pilot_attention_promoted_to_core","phenomenal_consciousness_proven","qualia_proven","sentience_proven","selfhood_proven","personhood_proven","moral_status_proven","autonomous_authority_created","profile_implementation_required"],"properties":{"id":{"const":"conscious-ai"},"name":{"type":"string","minLength":1},"backlog_classification":{"const":"EXPLORATORY"},"target_question":{"type":"string","minLength":1},"evidence_refs":{"const":["backlog_registry","core","capability_selection","capability_availability","counterfactual_intervention","fcl","non_binding_attention","interface_registry_v0_1"]},"observed_coverage":{"type":"array","minItems":1,"items":{"type":"string","minLength":1}},"observed_gap":{"type":"string","minLength":1},"outcome":{"const":"PROFILE_ONLY"},"architecture_interpretation":{"type":"string","minLength":1},"new_component_currently_justified":{"const":false},"implementation_authorized":{"const":false},"generic_self_generated_reentry_interface_established":{"const":false},"pilot_attention_promoted_to_core":{"const":false},"phenomenal_consciousness_proven":{"const":false},"qualia_proven":{"const":false},"sentience_proven":{"const":false},"selfhood_proven":{"const":false},"personhood_proven":{"const":false},"moral_status_proven":{"const":false},"autonomous_authority_created":{"const":false},"profile_implementation_required":{"const":false}}}
    ]}},
    "overall":{"type":"object","additionalProperties":false,"required":["result","outcome_counts","new_component_candidates","exploratory_entities_promoted","implementation_authorized","stable_core_change_required","interface_registry_successor_required","roadmap_priority_change_required","future_successor_audit_allowed"],"properties":{"result":{"const":"EXPLORATORY_SUFFICIENCY_NO_NEW_COMPONENT_CURRENTLY_JUSTIFIED"},"outcome_counts":{"const":{"REUSE_EXISTING":0,"COMPOSE_EXISTING":1,"ADAPTER_ONLY":1,"PROFILE_ONLY":2,"NEW_COMPONENT_CANDIDATE":0,"INSUFFICIENT_EVIDENCE":0,"NO_NEW_COMPONENT_NEEDED":0}},"new_component_candidates":{"const":0},"exploratory_entities_promoted":{"const":0},"implementation_authorized":{"const":false},"stable_core_change_required":{"const":false},"interface_registry_successor_required":{"const":false},"roadmap_priority_change_required":{"const":false},"future_successor_audit_allowed":{"const":true}}},
    "non_effects":{"type":"object","additionalProperties":false,"required":["stable_core_changed","spec_changed","principles_changed","contestability_changed","base_manifest_schema_changed","interface_registry_changed","backlog_registry_rewritten","roadmap_changed","workbench_reactivated","c2pa_reclassified","kontur_runtime_activated","authority_created","action_permit_created","external_effect_performed","release_or_tag_created"],"properties":{"stable_core_changed":{"const":false},"spec_changed":{"const":false},"principles_changed":{"const":false},"contestability_changed":{"const":false},"base_manifest_schema_changed":{"const":false},"interface_registry_changed":{"const":false},"backlog_registry_rewritten":{"const":false},"roadmap_changed":{"const":false},"workbench_reactivated":{"const":false},"c2pa_reclassified":{"const":false},"kontur_runtime_activated":{"const":false},"authority_created":{"const":false},"action_permit_created":{"const":false},"external_effect_performed":{"const":false},"release_or_tag_created":{"const":false}}}
  }
}
